{
  "graph_id": "eu-identifier-adversaries-v0.1",
  "identifiers": [
    {
      "node_id": "r794-celex",
      "scheme": "CELEX",
      "value": "32004R0794",
      "identity_level": "LEGAL_RESOURCE",
      "resource_kind": "LEGAL_ACT",
      "language": null,
      "version_date": null,
      "notes": "Base legal act."
    },
    {
      "node_id": "r794-eli",
      "scheme": "ELI",
      "value": "http://data.europa.eu/eli/reg/2004/794/oj",
      "identity_level": "LEGAL_RESOURCE",
      "resource_kind": "LEGAL_ACT",
      "language": null,
      "version_date": null,
      "notes": "EU ELI for the base act."
    },
    {
      "node_id": "r794-cellar-work",
      "scheme": "CELLAR",
      "value": "26f403d1-7656-4c91-9726-c08d466ff8bd",
      "identity_level": "LEGAL_RESOURCE",
      "resource_kind": "LEGAL_ACT",
      "language": null,
      "version_date": null,
      "notes": "Cellar Work resolved from CELEX."
    },
    {
      "node_id": "r794-eng-expression",
      "scheme": "CELLAR",
      "value": "26f403d1-7656-4c91-9726-c08d466ff8bd.0006",
      "identity_level": "EXPRESSION",
      "resource_kind": "LANGUAGE_EXPRESSION",
      "language": "ENG",
      "version_date": null,
      "notes": "Work-local expression suffix; not a language code."
    },
    {
      "node_id": "r794-eng-fmx4",
      "scheme": "CELLAR",
      "value": "26f403d1-7656-4c91-9726-c08d466ff8bd.0006.05",
      "identity_level": "MANIFESTATION",
      "resource_kind": "FORMAT_MANIFESTATION",
      "language": "ENG",
      "version_date": null,
      "notes": "FMX4 manifestation."
    },
    {
      "node_id": "r794-consolidated-celex",
      "scheme": "CELEX",
      "value": "02004R0794-20250813",
      "identity_level": "TEXT_STATE",
      "resource_kind": "CONSOLIDATED_TEXT",
      "language": null,
      "version_date": "2025-08-13",
      "notes": "Sector-0 consolidated text-state identifier."
    },
    {
      "node_id": "r794-consolidated-eli",
      "scheme": "ELI",
      "value": "http://data.europa.eu/eli/reg/2004/794/2025-08-13",
      "identity_level": "TEXT_STATE",
      "resource_kind": "CONSOLIDATED_TEXT",
      "language": null,
      "version_date": "2025-08-13",
      "notes": "ELI for the same consolidated state."
    },
    {
      "node_id": "r794-consolidated-nld",
      "scheme": "ELI",
      "value": "http://data.europa.eu/eli/reg/2004/794/2025-08-13/nld",
      "identity_level": "EXPRESSION",
      "resource_kind": "LANGUAGE_EXPRESSION",
      "language": "NLD",
      "version_date": "2025-08-13",
      "notes": "Language expression of consolidated state."
    },
    {
      "node_id": "r794-corr-celex",
      "scheme": "CELEX",
      "value": "32004R0794R(02)",
      "identity_level": "LEGAL_RESOURCE",
      "resource_kind": "CORRIGENDUM",
      "language": null,
      "version_date": null,
      "notes": "Corrigendum is its own legal resource, not the base act."
    },
    {
      "node_id": "r794-corr-eli",
      "scheme": "ELI",
      "value": "http://data.europa.eu/eli/reg/2004/794/corrigendum/2005-01-28/1/oj",
      "identity_level": "LEGAL_RESOURCE",
      "resource_kind": "CORRIGENDUM",
      "language": null,
      "version_date": null,
      "notes": "ELI of same corrigendum."
    },
    {
      "node_id": "r1958-celex",
      "scheme": "CELEX",
      "value": "31958R0001",
      "identity_level": "LEGAL_RESOURCE",
      "resource_kind": "LEGAL_ACT",
      "language": null,
      "version_date": null,
      "notes": "Historical act."
    },
    {
      "node_id": "r1958-eli",
      "scheme": "ELI",
      "value": "http://data.europa.eu/eli/reg/1958/1(1)/oj",
      "identity_level": "LEGAL_RESOURCE",
      "resource_kind": "LEGAL_ACT",
      "language": null,
      "version_date": null,
      "notes": "Awkward official ELI; '(1)' is authoritative and must not be synthesized away."
    },
    {
      "node_id": "r1958-cellar-work",
      "scheme": "CELLAR",
      "value": "115852e8-30ac-496e-8015-d580366ff059",
      "identity_level": "LEGAL_RESOURCE",
      "resource_kind": "LEGAL_ACT",
      "language": null,
      "version_date": null,
      "notes": "Resolved Cellar Work."
    },
    {
      "node_id": "r1958-eng-expression",
      "scheme": "CELLAR",
      "value": "115852e8-30ac-496e-8015-d580366ff059.0008",
      "identity_level": "EXPRESSION",
      "resource_kind": "LANGUAGE_EXPRESSION",
      "language": "ENG",
      "version_date": null,
      "notes": "English expression."
    },
    {
      "node_id": "dsa-act",
      "scheme": "CELEX",
      "value": "32022R2065",
      "identity_level": "LEGAL_RESOURCE",
      "resource_kind": "LEGAL_ACT",
      "language": null,
      "version_date": null,
      "notes": "Adopted Digital Services Act."
    },
    {
      "node_id": "dsa-act-eli",
      "scheme": "ELI",
      "value": "http://data.europa.eu/eli/reg/2022/2065/oj",
      "identity_level": "LEGAL_RESOURCE",
      "resource_kind": "LEGAL_ACT",
      "language": null,
      "version_date": null,
      "notes": "ELI of adopted act."
    },
    {
      "node_id": "dsa-proposal-celex",
      "scheme": "CELEX",
      "value": "52020PC0825",
      "identity_level": "LEGAL_RESOURCE",
      "resource_kind": "PROPOSAL",
      "language": null,
      "version_date": null,
      "notes": "Commission proposal."
    },
    {
      "node_id": "dsa-proposal-com",
      "scheme": "COM",
      "value": "COM/2020/825 final",
      "identity_level": "LEGAL_RESOURCE",
      "resource_kind": "PROPOSAL",
      "language": null,
      "version_date": null,
      "notes": "Commission document identifier for same proposal."
    },
    {
      "node_id": "dsa-procedure",
      "scheme": "EU_PROCEDURE",
      "value": "2020/0361/COD",
      "identity_level": "PROCEDURE",
      "resource_kind": "LEGISLATIVE_PROCEDURE",
      "language": null,
      "version_date": null,
      "notes": "Ordinary legislative procedure."
    },
    {
      "node_id": "dsa-oj",
      "scheme": "OJ_CITATION",
      "value": "OJ L 277, 27.10.2022, p. 1",
      "identity_level": "PUBLICATION_CITATION",
      "resource_kind": "OFFICIAL_JOURNAL_CITATION",
      "language": null,
      "version_date": null,
      "notes": "Publication citation, not an equivalent identifier for the act."
    },
    {
      "node_id": "r2019-1241-eli",
      "scheme": "ELI",
      "value": "http://data.europa.eu/eli/reg/2019/1241/oj",
      "identity_level": "LEGAL_RESOURCE",
      "resource_kind": "LEGAL_ACT",
      "language": null,
      "version_date": null,
      "notes": "Base resource for official ELI subdivision example."
    },
    {
      "node_id": "r2019-1241-art2-eli",
      "scheme": "ELI",
      "value": "https://eur-lex.europa.eu/eli/reg/2019/1241/art_2/oj",
      "identity_level": "SUBDIVISION",
      "resource_kind": "LEGAL_SUBDIVISION",
      "language": null,
      "version_date": null,
      "notes": "Article-level ELI example documented by EUR-Lex."
    },
    {
      "node_id": "cellar-doc-example-work",
      "scheme": "CELLAR",
      "value": "b84f49cd-750f-11e3-8e20-01aa75ed71a1",
      "identity_level": "LEGAL_RESOURCE",
      "resource_kind": "OTHER",
      "language": null,
      "version_date": null,
      "notes": "Official Publications Office Cellar identifier-format example."
    },
    {
      "node_id": "cellar-doc-example-expression",
      "scheme": "CELLAR",
      "value": "b84f49cd-750f-11e3-8e20-01aa75ed71a1.0003",
      "identity_level": "EXPRESSION",
      "resource_kind": "LANGUAGE_EXPRESSION",
      "language": null,
      "version_date": null,
      "notes": "Official Cellar identifier-format example."
    },
    {
      "node_id": "cellar-doc-example-manifestation",
      "scheme": "CELLAR",
      "value": "b84f49cd-750f-11e3-8e20-01aa75ed71a1.0003.01",
      "identity_level": "MANIFESTATION",
      "resource_kind": "FORMAT_MANIFESTATION",
      "language": null,
      "version_date": null,
      "notes": "Official Cellar identifier-format example."
    },
    {
      "node_id": "cellar-doc-example-item",
      "scheme": "CELLAR",
      "value": "b84f49cd-750f-11e3-8e20-01aa75ed71a1.0003.01/DOC_1",
      "identity_level": "ITEM",
      "resource_kind": "CONTENT_ITEM",
      "language": null,
      "version_date": null,
      "notes": "Official Publications Office Item/content-stream identifier example."
    }
  ],
  "relations": [
    {
      "relation_id": "r794-celex-eli",
      "relation_type": "SAME_LEGAL_RESOURCE",
      "from_node_id": "r794-celex",
      "to_node_id": "r794-eli",
      "evidence_state": "DIRECT",
      "source_refs": [
        {
          "source_type": "EUR_LEX",
          "identifier": "CELEX:32004R0794",
          "locator": "ELI field",
          "role": "EQUIVALENCE"
        }
      ],
      "notes": null
    },
    {
      "relation_id": "r794-celex-cellar",
      "relation_type": "SAME_LEGAL_RESOURCE",
      "from_node_id": "r794-celex",
      "to_node_id": "r794-cellar-work",
      "evidence_state": "DIRECT",
      "source_refs": [
        {
          "source_type": "CELLAR",
          "identifier": "http://publications.europa.eu/resource/celex/32004R0794",
          "locator": "303 redirect / SPARQL sameAs",
          "role": "EQUIVALENCE"
        }
      ],
      "notes": null
    },
    {
      "relation_id": "r794-expression-work",
      "relation_type": "EXPRESSION_OF",
      "from_node_id": "r794-eng-expression",
      "to_node_id": "r794-cellar-work",
      "evidence_state": "DIRECT",
      "source_refs": [
        {
          "source_type": "CELLAR",
          "identifier": "32004R0794 / ENG branch",
          "locator": "expression_belongs_to_work",
          "role": "HIERARCHY"
        }
      ],
      "notes": null
    },
    {
      "relation_id": "r794-manifestation-expression",
      "relation_type": "MANIFESTATION_OF",
      "from_node_id": "r794-eng-fmx4",
      "to_node_id": "r794-eng-expression",
      "evidence_state": "DIRECT",
      "source_refs": [